小学六年级的学生对老师发布的任务置若罔闻，还干扰其他学生完成，不停的说些与课堂教学无关的话，与之沟通东拉西扯，哪位同仁有解决此类问题的高招？,小学六年级的学生，对于老师的批评教育总是抱着无所谓的态度，有什么更好的办法引导学生？,5
怎样才能让孩子自觉做作业呀？苦恼??,学生上课爱睡觉怎么办
怎样让一年级新生学会识谱,遇到精神有问题的学生怎么办？
对于变相体罚，你是怎么理解的？,请问，学生不想上学，出现了厌学的状态，怎么办？
怎么做才能做到学生心里最好的老师,如何不让孩子们在百度作业帮上查答案？
刚刚注册了“好教师”，送花任务怎么也完不成，怎么送花呢？,尊敬的各位教师前辈，在这个物欲横流的社会上，大多数人只看到了我们作为老师，光鲜亮丽的外表，或者说只看到了表面的我们，完全不知道，我们在工作中是多么辛苦，有时候忙的连水都喝不上一口。我常常用一句话来勉励我自己，工作虐我千百遍，我待工作如初恋??。我想请问，大家是靠什么支撑着在这个岗位上一做就是几十年呢？
孩子写作业不认真，写一会就跑去干别的事，有什么办法让他能认真坐下写作业。,学生上课接话严重，怎么办，，.，，
城乡结合处的小学生如何学好英语？家长不管或者不知道如何辅导？请各位赐教！谢谢啦！,孩子学习没兴趣，怎样让被动学习变为主动学习？
为什么今日送花是总显示该用户产品数量不足。,好老师们，向你们请教一个问题:班上有77个学生，委托组长检查效果不佳，那老师该怎么检查呢？
复习阶段有些难熬，老师辛苦，学生却很放松，难道是我太小题大做了，还是学生早已胸有成竹了。,根据您的专业知识及工作经验，针对具体的问题描述您现阶段所教学生的年级，及其在您课堂上表现出来的思维特点，并写下您认为1-2个适合这样思维特点的教学方法或技巧。
